{
  "schema_id": "execution_event_record",
  "schema_version": "v1",
  "created_at_utc": "2026-03-02T00:00:00Z",
  "event_time_utc": "2026-03-02T00:00:00Z",
  "binding_hash": "9f5955983b07c2b4eea8232e98734df7d8b0a4cf47d069ba2fd95e8c233c711e",
  "broker_submission_hash": "59d93720393d7c3ec9454037cd53da0e41619398e53050d2d7cafea4aaebb853",
  "broker_order_id": "0",
  "perm_id": "0",
  "status": "REJECTED",
  "filled_qty": 1,
  "avg_price": "500.00",
  "raw_broker_status": "CONTROLLED_TEST_REJECTED",
  "raw_payload_digest": null,
  "sequence_num": null,
  "canonical_json_hash": null,
  "upstream_hash": null
}
