{"avg_price":"1.23","binding_hash":"ead8fbb1affd1185aff1cb98cd1d777f3ce4ce1024bb3f3aac431000bcecfcdc","broker_order_id":"1","broker_submission_hash":"aba85ee0b6ff914c0586142e72b86331decf5bc56ebd6758f20a31cae995cfa5","canonical_json_hash":"98f147b73eef9d033ff8a2374ff241ad5e921e26783a893353753821e8f5467d","created_at_utc":"2026-03-07T00:10:00Z","event_time_utc":"2026-03-07T00:10:00Z","filled_qty":1,"perm_id":"1","raw_broker_status":null,"raw_payload_digest":null,"schema_id":"execution_event_record","schema_version":"v1","sequence_num":null,"status":"FILLED","upstream_hash":null}
