{"avg_price":"0","binding_hash":"b7562242a29889a62efd4d46015ec58aed84666b1303c6356ba721d392418944","broker_order_id":"18","broker_submission_hash":"a2341a5e416695fb8a82db184cd412179dfd1809f3a2fefe9a5f5b15e027dc92","canonical_json_hash":"4c37c536a09421df905dd7022297745484ba084a314140e883be8dc2cb321a68","created_at_utc":"2026-03-06T00:00:00Z","event_time_utc":"2026-03-06T00:00:00Z","filled_qty":0,"perm_id":"144081048","raw_broker_status":null,"raw_payload_digest":null,"schema_id":"execution_event_record","schema_version":"v1","sequence_num":null,"status":"UNKNOWN","upstream_hash":null}
