{"avg_price":"1.23","binding_hash":"ead8fbb1affd1185aff1cb98cd1d777f3ce4ce1024bb3f3aac431000bcecfcdc","broker_order_id":"1","broker_submission_hash":"5037795da2312a5aa63d1aa2a225b05f339a9ad160685d66e41944c137b9e5be","canonical_json_hash":"0004bcbbe7a4d283d49e1513494324aa3ef848de7b742e013a9340758326859d","created_at_utc":"2026-03-06T00:10:00Z","event_time_utc":"2026-03-06T00:10:00Z","filled_qty":1,"perm_id":"1","raw_broker_status":null,"raw_payload_digest":null,"schema_id":"execution_event_record","schema_version":"v1","sequence_num":null,"status":"FILLED","upstream_hash":null}
