{"avg_price":"0.38","binding_hash":"f9220780e53eacea602cb86f8a01386f7e40a5804717f153220f6a893da28b49","broker_order_id":"SYNTH-f9220780e53e","broker_submission_hash":"0be0986c574dace5bc9b06b5d1d393914a70456c6c8532c7e1264c70957352f4","canonical_json_hash":null,"created_at_utc":"2026-02-20T00:10:00Z","event_time_utc":"2026-02-20T00:10:00Z","filled_qty":1,"perm_id":"SYNTH-f9220780e53e","raw_broker_status":"SYNTH_FILLED","raw_payload_digest":null,"schema_id":"execution_event_record","schema_version":"v1","sequence_num":null,"status":"FILLED","upstream_hash":null}
