{"avg_price":"1.23","binding_hash":"ead8fbb1affd1185aff1cb98cd1d777f3ce4ce1024bb3f3aac431000bcecfcdc","broker_order_id":"1","broker_submission_hash":"eb43655f998ca9bcda0f48595df59ed3a7f678f390b386f7578208782546ae9a","canonical_json_hash":"0be6e900307e9d2f6ac53a1e45d7a5f72798c47f22d448548a36833d3b8ff268","created_at_utc":"2026-03-09T00:10:00Z","event_time_utc":"2026-03-09T00:10:00Z","filled_qty":1,"perm_id":"1","raw_broker_status":null,"raw_payload_digest":null,"schema_id":"execution_event_record","schema_version":"v1","sequence_num":null,"status":"FILLED","upstream_hash":null}
