{"avg_price":"1.23","binding_hash":"ead8fbb1affd1185aff1cb98cd1d777f3ce4ce1024bb3f3aac431000bcecfcdc","broker_order_id":"1","broker_submission_hash":"2d27268433a7b1b1bb99caa30747974d1292c185469362871c1eb73ef0b38bc8","canonical_json_hash":"ab4ded5803c24697215d8c076fb3fb55d0747fe7ccbe9c48a8052354f384903b","created_at_utc":"2026-02-23T00:10:00Z","event_time_utc":"2026-02-23T00:10:00Z","filled_qty":1,"perm_id":"1","raw_broker_status":null,"raw_payload_digest":null,"schema_id":"execution_event_record","schema_version":"v1","sequence_num":null,"status":"FILLED","upstream_hash":null}
