{"avg_price":"0.38","binding_hash":"ef2ae8481877e26c749d4a7128dd247e00f6adce1f98ca984b49a326736f6825","broker_order_id":"SYNTH-ef2ae8481877","broker_submission_hash":"b334bb0105019ebd65cc5c5dc8c0c41dfb8fb34762ca13eda0941ec06fe5c9c5","canonical_json_hash":null,"created_at_utc":"2026-02-25T00:10:00Z","event_time_utc":"2026-02-25T00:10:00Z","filled_qty":1,"perm_id":"SYNTH-ef2ae8481877","raw_broker_status":"SYNTH_FILLED","raw_payload_digest":null,"schema_id":"execution_event_record","schema_version":"v1","sequence_num":null,"status":"FILLED","upstream_hash":null}
