{"avg_price":"1.23","binding_hash":"ead8fbb1affd1185aff1cb98cd1d777f3ce4ce1024bb3f3aac431000bcecfcdc","broker_order_id":"1","broker_submission_hash":"89b82fe0768bcf730b97b761b10ea267181ba74a31220f1c89906d5779f0c295","canonical_json_hash":"90db29882c530ec4b6ca653f3ea8c1e01b7b088ca955f72102aba4d8af599a59","created_at_utc":"2026-03-10T00:10:00Z","event_time_utc":"2026-03-10T00:10:00Z","filled_qty":1,"perm_id":"1","raw_broker_status":null,"raw_payload_digest":null,"schema_id":"execution_event_record","schema_version":"v1","sequence_num":null,"status":"FILLED","upstream_hash":null}
